{"critical_event_drop_count":0,"event_count":79,"files":{"checkpoint.json":"e9a0fd6cb43f8c19a6daec3a617829070e924336271bcc5e5fdd18384dd3fdeb","checksums.json":"09aee7a284f9bccd6447b9ee005c4982eda3d3cce017e07365297e6fe9357ecf","events.jsonl":"307404a1d36f7eb279fe728d5f4c177bf18de1d9a740eb5856d72d4e9262847e","state-digests.jsonl":"c25c992c4129b8945dd34081dbe28d2f895d25fdcf2827cf06c4fa0852c520a7"},"final_state_digest":"8678d4d2a8442c7b56830d326fc7874f5473e92357883e7402e38a2545420a55","finalized":true,"manifest_digest":"881cbeaf50b05ab44c70a94c6ad13fe04e33dd22144b9080039b70cd46a2b692","non_replayable_reasons":[],"privacy_mode":"metadata_only","replay_capabilities":["R0","R1_TOY"],"run":{"arch":"x86_64","critical_event_drop_count":0,"event_schema_version":0,"git_dirty":true,"git_revision":"5d6e3699a05046373717138100bb910733214c6d","implementation":"CPython","os":"Linux","privacy_mode":"metadata_only","python":"3.12.3","seed":7},"schema_version":0,"seed":7,"steps":20}
