{"critical_event_drop_count":0,"event_count":79,"files":{"checkpoint.json":"e9a0fd6cb43f8c19a6daec3a617829070e924336271bcc5e5fdd18384dd3fdeb","checksums.json":"373807b62772cc639aa42fb9c0f07ab82eaef5683462de8e0cf81e7435cbed20","events.jsonl":"a22cd7d1de7c52eac0d8bf17a86e7b89d747631176951547f56dffb54311f955","state-digests.jsonl":"c25c992c4129b8945dd34081dbe28d2f895d25fdcf2827cf06c4fa0852c520a7"},"final_state_digest":"8678d4d2a8442c7b56830d326fc7874f5473e92357883e7402e38a2545420a55","finalized":true,"manifest_digest":"95a433893f72d61966b196fd39da46f358758101e106b54fd4f36eecd89a99a3","non_replayable_reasons":[],"privacy_mode":"metadata_only","replay_capabilities":["R0","R1_TOY"],"run":{"arch":"AMD64","critical_event_drop_count":0,"event_schema_version":0,"git_dirty":true,"git_revision":"unborn","implementation":"CPython","os":"Windows","privacy_mode":"metadata_only","python":"3.14.7","seed":7},"schema_version":0,"seed":7,"steps":20}
